179,Sa,"	Yeah, no, that was the only thing that I had sorted  because everything else, like I cant find a job unless I would go in an interview, I can't find an apartment without going and seeing it, I cant set up a bank account until I go into the bank so Airbnb wass the only thing I can do from abroad where I like filter that down through super hosts and…I want to make sure that you know, the people Im staying with are good like that. So it's about like okay, maybe don't stay like, alone with a man, in a weird part of town you know, you know. So that was the only thing I had coming over. But it was really good to have someone coming over knowing that I had somewhere to be. At least it was like I'm going somewhere these people are expecting me to come here so it was kind of helpful."
180,M,"	And organizing like your kind of move, like your travel from the airport to home did"
181,you do Uber or like things like that? ,
182,Sa,"	So I knew the directions from the metro. I knew that the place of staying was near a Metro. I was like that’s hand. But I did factor in the fact that I had a massive bag and two other bags with me, and I was just a tourist hanging. And so I had a few homeless people, like, like a few rough looking people come up and kind of chat with me, so then I was like, I'm just gonna take an uber for the rest of the trip. So I would recommend that, like you get to the airport and its straight into town, but I was like, yeah, ubers are much cheaper here so you just get an uber where you're going. Yeah they were great [uber and Airbnb] because it was so much cheaper like 250, for two weeks, two weeks, which is very good. I mean, like, I stayed at a really bad hotel that night when I saw the mouse. And that was like $60 $70 and if you do pay for two weeks of that, that's a lot more expensive but also it was horrible. So I'm like, it was like a one star hotel where it's like, at least at Airbnb, you have insider knowledge, people tell you stuff. Like they told me like, they set up my internet for me, they were really helpful. definitely would recommend that. Can I write this down like a travel section? And so I'm just going to come in here and then it was so Airbnb first. I Had a girl that lived here before. So she was… she went to college with me. She did same courses with me and then then moved here for two years. I remember seeing her pictures in Montreal so she sent me a document of that she sent to the guy who was taking over her job, but it was all like, what you need to know about living in Montreal. So she told me to look at the plateau which was great because I actually messaged her when I came here the first week. I only had 2 house viewings and I didn’t go to the first one because she told me not to because she was like, look, like you can go see it. She was like look its not the best street. Even the place that you live in is nice, your walk home isn’t going to be great. She was like a if youre living on your own, I just wouldnt recommend it. So I ended up just cancelling that and then I was like look I found somewhere else. So, I didn't go to that one. And then I got the viewing for the place that Im living now. And she was like, that is an amazing spot if you can get that in any way, take it. So, it was a huge help having her to be honest, to be honest. I mean, I could have ended up in first place and it could have been fine. But like, having someone who knows is so great. Like I'm from Ireland. I've been to Dublin. Like I know. I know things about living in Ireland. If you don't live in the city itself, if you don't know this exact area, if you don't do this street. I mean, you could take this is a great area, but this particular street isnt nice, you know, it's it's beneficial. Yeah. So having her like her insider knowledge was very valuable. I mean you could maybe find it online but then you would find like posts that were made in 2008. You know like, I don’t know if I could trust this stranger. But I knew this girl. I was like I knew, like, you know, to make sure we have similar ideas and stuff. So I was like, if she was advising it, you know, I, gonna trust her like, so it's Yeah, it was very helpful. I mean, like, you could, I suppose you need to know the area and its hard to like “ask where is good to live” coz everyone has their own opinion. So yeah, that was good. And what else? "
183,M,"	Okay. Yeah. All right. We were just gonna move. I mean, you actually kind of spoke about this person. Anyway, so I was going to move to social connections. Yeah. So you already told me about this particular person. But yeah, otherwise as well, friends, family, greater community, professional networks that helped you in your journey?"
184,Sa,"	So okay, I'm gonna put her down. Yeah. So she was probably the first that I had any kind of, in Montreal. initially I think I messaged her like a year ago I was like thinking move here I'm thinking of moving said lot of places. Would you recommend anything? And she was like yeah move here. So Im gonna say friend from college and then I don't knowlike, now that Ive come here, I mean haven't had a huge… yeah like it was mainly just I talked to like other people that have lived in Canada so like other people… so yeah friend of mine from work she lived in Vancouver so and they were like this little group you have like this like people living outside of Ireland. So yeah,  And I can write the Facebook group here and then that website as well. The move to Canada one, they have forums and stuff if you wanna post any questions or whatever. And here I’ll write down bumble and meetups but haven't fully used them yet but I'm just gonna write in the future because when it starts to snow, and I get more alone… yeah"
185,M,"	In terms of technology, sorry, now that you're here, do you provide advice to anybody? Do you actually go on forums and say, or this is what you can do or…?"
186,Sa,"	I haven’t done that yet because I think when even like the odd questions you pop up in the likes of forum thing I'm like, I haven't done that yet. So, I can't advice but I probabl;y should. I mean, I did a Google review the other day and I never use google reviews and I remember talking to my brother about it and he's big for TripAdvisor. He uses it for everything like here. He came see me in Dublin for like a lunch. And he was like, Oh, I think this place is number one on TripAdvisor. I was like, all right. Like I live here, I know theres a few places that are good. But he was like, but this is on Tripadvisor so hes very like, he's very trusting of it. And then was like, all right, well do you post on it and he was like no and then I was like you should. And then I realized that I should because I use a lot of like I would use the internet live like best place to go for this.. like best bagels in Montreal. I use it a lot. So I probably should. I put like one google review the other day for a restaurants because I went with my friends and it was so cheap, and so nice. And staff are amazing. Like, you know, like I'd be really compelled to do it if I had a really good experience. if I had a bad one.I know I probably should left a bad one for that hotel that night. I was just worried that like the guys would know that it was me. Coz Id just left that day but it was aweful. But then I went on to booking.com and like all the reviews were pretty bad anyway, so so I was like I didn't stay here because it was it was good reviews. I stayed here because it was the cheapest and closest space in my house. Okay. But anyway, um, No, I haven't given any advice, but I If I saw someone like obviously asking questions or like if they were like, Oh, I don't know about this. I mean, somebody told me theyre coming to montreal from Ireland, I would definitely sit down with them for three hours. And I think I'm still learning. Its all new for me. And I'm kind of like, I don't know, like why you asking me it's like, when people come up from the street? And they're like, asking for directions are and so I'm like, I'm trying to even come up with the words to respond to them in French, let alone tell you. Where I don't know where I am. I don't know why people approach me because I clearly look lost. I'm looking at Google Maps and someone's like, do you know where this is? "
187,M,"	And this French, I mean, just the language, sort of play a part in how you navigate"
188,the city or do you feel that's that's got anything to do with your experience of living here?,
189,Sa,"	It has made like, I kind of like it, that I kind of like that theres a different language, and I don't know why. I find it I like the challenge if I like, I don't know, like when I came here first it was a bit of a shock that it was so widespread. And that's funny because Montreal people will tell you yet that the plateau and all these others  places there's so much English speaking there is so much English like 70% English and 30% French. I don't think that I think everyone speaks French so I think it's a bit of a shock when I get here first that, every when you hear in the background is speaking French and there was something nice about it though because it sounds like I'm here somewhere different, different culture, theres something new because like like I mean I can look at a sign and figure it out and like if you gave me a menu I can figure out most of things on it. It's like, it's nice to kind of feel like your brain has been trained to get into like work through stuff. Now I find it really hard to hold a conversation because even if I figure out exactly my word for oatmilk, I remember to request it, and then they ask me something in response and Im like… I don’t know. It is difficult, but when you learn a few words, and then you kind of make some effort to communicate someone it actually makes really good. So yeah, I actually like having it. And I would recommend those people like that they'd have had it in school. Say my friend that came she was at school with me. So she remembered few words and she was able to, like, do a few bits herself. I mean, if it was in German or in some other language like, I don't know if, like I was in China, I’d be fucked. I mean, it does help that I have some familiarity, but it's definitely a shock. Initially, when you realize oh, no, everyone does not speak in English. Just to hear it in the background, its even wierd, like speaking English. Even when I started my job was like, Oh, I can speak English. Okay, you know what I mean? And speaking with the flow as opposed to ummm.. could I … like trying to figure out stuff. "
190,M,	This may not apply to you but um any humanitarian or social support services that use like NGO or community service organizations or anything like that did that ever common? 
191,Sa,"	No. Okay news anything like that? No The only like, humanitarian like NGO like I mean I tried to like set up a volunteering when I came here first but that was for myself to volunteer. I tried to then they were like we will get back to you and yeah, and then because it was before I got the job, so I was kind of like, how can I lose time but then I was like, I don't know if you can Yeah, so I don't know, maybe in time ago nice now that I'm so good and no, I didn't I didn't use it. "
192,M,	Immigration policy?
193,Sa,"	And so, the main thing I'll say is that I think we're beyond lucky in Ireland because our passports like qualifies us to go so many places and it's I think we don't realize how easy we have it. Like even someone who went to Canada and we'll talk about at work work, like they qualify to come to Canada but it would like so much harder for them to try and work abroad and like we really move so freely across Europe and like, like, everyone I know. It's like the worsening now I know with Brexit and how that's all changed. But like people in Ireland are always like Im moving to Australia or im mving to Berline, always moving somewhere and you're going to work and apply and you just have to set up your papers, whatever. Even to move to Canada bit extra to do but still fairly straightforward. So a girl from India who I worked with in Dublin. She had such a nightmare. She had to apply for a new visa every year. There was a rule where she… she left Ireland for like 1 day or 2 days in something in this calendar year and if she didn’t, theyd take away her visa. It was just awful. So I was kinda like, Yeah, I don't know they do realise that you work here. So I think it's made me more interested. So it's made me really I know, it's hard because generally, people get into  policy or policies that affect them. So basically, you know, you'll always see people like fighting for cancer research because they're mum died of cance and they are angry and rightfully so and they want something. So it's different when…. I think it’s a big privilege when you got everything handed to you that you're kind of like, this doesn't affect me or is like, I don't know, it's hard because I'm kind of like I said it was the same it feels wrong for it to be easier for one person and harder for another. It feels wrong that people get put in cages in America and deported because they just want to live there. I mean, that's, I mean, that's like a whole other issue, that’s like, asylum and that's like people that actually need to live there. Not just someone like me who’s like “I would like to go to Canada”. I mean, it's so, the privilege we have is completely ridiculous. But yeah, it has made me more, if not involved in it, definitely more like aware of how, like when you hear about people like struggling with little kids, you're like, oh, like I can't believe that you have to worry about that when I don't you know, and it really makes you realize that privilege. "
194,M,	I think we're kind of almost towards the end of it. I suppose I just want to ask you about the biggest challenges or obstacles that came your way in moving. Is there is there anything that you want to say on that?
195,Sa,"	The mouse. Yeah I can draw a little mouse. I’ll put the mouse because the mouse really affected me, and the health thing and the whole thing I mean, not being able to… like which hospital am I able to go to, what does my insurance cover? Whereas in Ireland it was just like, Ill just go to the nearest clinic. Its an added anxiety maybe. And the it's mainly the social aspect of it, it's not so much that I miss, like, and I miss not having my friends as well. Or that I really miss people that I love all my god, I miss them so much. I really want to see them, I don't have that so much. But it's little things, like habits that you have, and maybe it's an Irish thing of like the drinking culture that we have – its true [laughs] But like even like going for drinks after work on a Friday, like something like that, that I really miss that like it's mainly the weekends when you're…even last weekend and I'm like, I don't have this and it's like, whatever, everyone was like going home and like, have friends coming in. And Im like, I'm just gonna like, chill in my apartment. Do you know what I mean? Bit’s like that makes me feel a bit disconnected. Well, I mean, my friends have literally messaged and talked to me non-stop every day is almost like another job to try and keep up with all the correspondence like trying to get back to everyone. But it's Yeah, they've been very supportive. Yeah, that's the main challenges I mean, being on your own like yeah, I think it's just a big thing as well in that even if you enjoy it any kind of whatever it's different when it's so like say when you’re off over a weekend, there's always something to do when you're home, you have to go home, or meet someone for a coffee, like you to do all your social to do’s. And then when you the morning free to yourself for half a day and youre like yeah I need to go do something for myself myself. That's really nice when it's a choice, but when it's we don't have choice in it, It's doesn't it takes away some of the good from it. So like I'm like, yeah, it's very much enjoying going somewhere on my own. I very much enjoy spending the day by myself, but when you know, I mean, it's nice to still have the option that I might meet up with a person later. "
196,M,	They don't really have a culture of like going Friday night drinks?
197,Sa,"	I think it really depends. I think it's really the place where we are so I'm literally in a warehouse in the middle of an industrial park. There's no… I think the closest hotel is like a 20 minute walk and there's no cafes nearby there's no shops nearby there. If you forget your lunch there is this like truck that goes by and I think that like, that’s your only option unless you have a car and you can drive to wherever. There's nowhere nearby. And like even when I was coming into the interview, I decided that I was gonna hate this place because I hate the look of industrial parks. You know like, when youre near and airport, you know what that looks like, its like urghh. So I think that's the main issue. We had like a team lunch the first week, you know, because I'm not the only new person who have which makes it a lot easier. And then they were kind of talking about doing like an Oktoberfest thing, and then maybe a drinking thing. And then before the Christmas party, so it feels like they will do social things. But I think it's more difficult to where we are. And they were kind of like, what we're going to go, you know, and then people were like, well, maybe we should just stay here in the office or drink here, because, you know, everyone is pulling from different areas. And they’re like its little warehouse, and if we drink here, you know, someone is going to get injured. And so it's kind of like, where do we go then? Because we need to get a Metro and a bus. It's mainly the location, I think. I mean, everyone there has been really nice, but I suppose it's the same as anywhere when you start somewhere new you're kind of like, I'm gonna be really nice and polite, but I don't know what your personality is. Yeah, I don't know if it's okay to do this, and alcohol just helps with that [laughs]. "
198,M,	And do you plan to maybe change your jobs in the future?
199,Sa,"	No, because a lot of jobs that I applied for, I didn't hear back from. And there was one that was like, super stressy. And they were like, can you do like 50 things to get up to the next stage. Before you will even be interviewed before you even have a chance to meet anyone. So, like I didn't want a high stress job. And this job is not stressful, I don't even think people are checking on me. It's like, amazing, like they're so positive and no one's kind of looking over their shoulder making sure you're doing the work. So I don't want a job that I'm going to be obsessed with or stay late at or, you know what I mean? So I think and because like, find a job and setting up and then get holidays or something like that because I need to take Christmas holidays, I need to take holidays in March, and then that would be six months. And then I'm like, well, what's the point of finding a new job I’m here for a year. I think I'm fairly sure I want to go and stay for the year, if that, if don't like it, I might go home sooner. "
200,M,"	Oh, really? Okay. So you don't select? I mean, I was gonna that would be my next question. Yeah. Next steps in terms of staying here. You just want to stay here for a year? "
201,Sa,"	I think so. Okay, you know, you never know what might happen. But yeah, like I could end up staying and making more friends find someone here, you never know. But fow now. No, I think I've always seen it as like a short term thing. I'm just here for I just want to be here for a while… I want to challenge myself to live on my own. I want to challenge myself to go somewhere completely new and completely different. Find a job like all these things, Like Im done with some of the hardest parts now. And now its just like adjusting. Like I don't know if this part is going to be the hardest because it's always different when your mind’s occupied it has so much to worry about. Like, oh I need to find my apartment, now I need to find a job, and my friends visiting but once they go and you know it starts to snow it's going to be a bit more like, okay, now you have to like, not only be okay living here, but try and enjoy it as well. I think quite keep it short term, like a year or maybe even less than a year, then I'll probably make the best out of this place. I think it's if I keep the short term, I'm really trying to value it and I'm like no, enjoy yourself. I mean, you're not going to have this next year you're going to be home and Dublin or go away and you want to be like I wish I was on my own again. So I'm kind of like trying to be you know, trying to enjoy it as much as I can."
202,M,	And I was just wondering also your any aspect of romantic relationships. That sort of does that any is does that say the role anywhere? Is that a motivation at all?
203,Sa,"	So before I moved to here, so I was in a long term relationship for about six years, and that ended badly. So that was I think summer 2018. I think initially, your initial thing is like, I gotta move out, I gotta do something. I gotta cut my hair. I gotta go.. And then I was like, No actually gonna keep going and like, cuz I wanted to eave my job in summer 2018. And I was going to move to go away with him. And that was the whole plan. So then I was like, Okay, this big thing just happened. I don't want to change something else big in my life. You know, you've got your base, who youre with and your job. So I was like I'm going to say my job for maybe another year, and then I'll do and then I'll figure out something else. So I think that was partly why you wanted to Do something different, but I will say, That's why I came here because I don't like because many people have asked me like, did you move because of the’bad breakup? And Im like Well, no, I didn't mean to get away from anyone.. I didn't move to, like escape or whatever, because it was like, I always want to travel. I knew when I started, that he didn't. And I knew that would be kind of part of my life that I wouldn’t ger to do enough. I was kind of content. I don't think I felt that I was missing out on anything at the time for, I think it was all like, I mean, he knew that too, like many people do, My parents used to say it. They were like, oh, D, S are abroad. But you know, we always thought to be Sarah, you know, everything. And I was like, Yeah, okay, whatever. So it was always something that I knew that I wanted, and then eventually when the opportunity presented itself was like, so yeah, so I think that's why I gave myself a bit of extra time to kind of, coz obviously a breakup is hard, it's almost like I don't want to do this as kind of a reactionary thing. And then by Christmas and I was like all right yeah, I'm feeling good, Still though, I’d like to be single for a little while. Obviously when I have the long term or the short term idea in my head like that I'm not going to be living here for years and years. I mean it may be if I was in Ireland it might be different for I mean, I'm not definitely not actively seeking a relationship nor would I I mean, again never say never. I mean my parents were like you could me meeting someone in Montreal and stay there for 10 years. But I'm not really romantic like that. I still think I need a lot more time. I had a great year but being in a bad thing like that is hard. When you kind of get out, initially you’re upset but now I'm like, I'm actually really enjoying everyon,  I really like, you know, I like the fact that I'm here. I've never been here. I've never gotten this opportunity. So, it's kind of like it's all for the greater good. Yes, it has made me be a bit more like no to that. So yeah, maybe in a year."
204,M,	I just kind of want to get your thoughts on what you feel about it. Is there anything else that you'd like to add to it?
205,Si,	10th of October so we're just 2019. So that's very recent. 
206,M,	And what were the motivations behind your move?
207,Si,	I wanted to learn a new technology. So learning new technologies that was basically my motive. I'm doing to specialization in big data. 
208,M,	And this is where back this isn't in your India you're studying in India prior to this?
209,Si,"	I have a work experience of 10 years into data handling so Im abusiness intelligence consultant and worked on this domain for eight to nine years, right. I worked as a trainer as well as consultant. So from last two, three to four there is a lot of hype regarding huge data is getting accumulated. And there should be ways in which how you're going to handle the data. When I talk about business intelligence, it is all about whatever data which you have, and the previous data, how the previous data can be used. So, this particular business intelligence model, it only helps us to predict how to work with previous data. But what about the data currently, which we have and how we will predict the future of the data? So that is what is your data science and big data technology. So I was keen into learning the next level as a having them of experience. So I want to evolve from one profile to another. So I'm over here to learn Big Data."
210,M,	What was the sort of factors that made the decision of coming to Canada like what else were you thinking of? Couldn’t you study in India?
