330,Su,"	So I was born in Islamabad. So my dad was a diplomat. After every two foreign postings he would have to come back to Islamabad to work at the Foreign Office. I was in Islamabad. When I was 2 I moved to Baghdad for about five years in Iraq and then then I moved to Indonesia for about three years. Then back to Islamabad when I was about seven, eight, and I went to school in Islamabad so this is my first sort of thing with with Pakistan. But Islamabad is very different culturally from Pakistan, from Karachi because there's a lot of foreign population like theres diplomats and stuff. So you don't really feel the typical-ness. You know, it's not claustrophobic, it's, it's a little more broad. And then after Pakistan, we moved to the Netherlands for about six years. I think that was my dad's longest posting and that was kind of like, has in a way become home for all of us in some way or the other and then after the Netherlands, I moved to Russia. So I was living in Moscow for about three years. My dad retired some time in February 2008. I was still in the middle of high school, I was doing my International Baccalaureate, and then so I obviously could not it was like, couple of months ago, my final exams I was seeking move back to Pakistan with them. So I stayed on in Russia all alone. And that was a lot of fun. But apart from that, like I learned about, like, what the Russian culture and about so many things and about just just how like, you know, and I remember ever since I was like, you know, 10- 11 I would just go on and on about Pakistan to my friends and how amazing the culture is I was just one of those like, you know, it's very proud of all of these things and, and people just like my wedding happened in December, and all my friends were like you've been raving about Pakistan for like, as long as we've known you. Like, we're so excited to come. They all, well, some of them came and, like, you know, it was nice. So, then I moved to London to do my law at UCL and then I thought I didn't want to do my bar, whatever I came back to Pakistan. And yeah the story starts from there in terms of work and then finding like, what I'm good at what I what my passions are, like, you know, all that kind of stuff. And it was very difficult sort of moving a step forward, because they're like, but your lawyer, why wouldnt you want to practice law? Why would you want to do this? Why would you want to do that? So So we actually did, like a couple of friends. We actually close… but honestly when I practice law, my my impetus was not to become like a corporate lawyer or like whatever you see in suits or whatever and all of that stuff and makes shit loads of money. It was…it was more like, I wanna work. So criminal law I want to do Human Rights, that's where I was heading towards. And both things in Pakistan are a challenge because a woman being a criminal lawyer, anyone being a criminal lawyer and most of the criminals are very sort of notorious. And you know, I started I remember I started visiting kurachi Central Jail quite a few times to get an idea to get people's stories because I liked writing also, I like writing also, and I remember getting calls and getting tracked and all of that kind of stuff. So that was, you know, just a little uncomfortable. So basically that happened then and then we like couple of our friends were like very passionate and stuff. We, together with the guidance of Asma Jahangir, she's she's a very well known like activist add lawyer in Pakistan. So we started this legal aid clinic, whereby we would work with people who could not afford Legal Assistance which is 70% of the population. So you know if there was like land crimes and you know people taking over their property or people taking the land or people taking over whatever… like whatever is domestic violence or domestic divorce, the husband not giving the divorce, whatever it was, we were kind of solving it and than unfortunately I got a job into another good corporation which was linked law remotely and so I said okay, why not? But I kept in touch with the legal aid clinic and I believe it's doing really well right now. It's it's like when we started we were like, like working from like, what like, basically just like someone was kind enough to give a room from their house, like, somewhere in Lyari, right which is a very…was a criminal infested area. But then, now I believe it has its own office and all of that stuff so it is picking up. I would love to do that kind of thing in Pakistan but unfortunately like, you know, there's implications to that. Yeah as there is anything that's a little out of, you know, boundaries or whatever. And there are a lot of boundaries. "
331,M,	So tell me about your your marriage so I mean your wedding. How did you meet your husband? 
332,Su,"	So I have met my husband about three years ago at like, so we knew each other through a lot of mutual friends but we never really like met and spoke. But then like a friend of mine, and friend of his suggested that we…like we should probably like, get to know each other and it was a mutual friend of ours whose wedding it was. And so, he introduced us and then you know, one thing led to another we started sort of like, this is December 2015. And he was only there in Pakistan for a holiday and I don't know what happened to me but I just took… I'm very careful about these things but I just took a leap of faith and then we started having a long distance relationship. I told him that like, the only the only way I'm gonna have a long distance relationship with you is if we make an effort to meet after three, four months whether that's, you know, Im not asking you to come all the way to Pakistan or I'm not going to come all the way to Canada but lets meet half way. Otherwise not going to work on the phone and all that stuff. So we try to make an effort to that consistently as possible. Year and a half into it, he wanted me my family. I met his and then from then on. We kind of like, sort of… Oh, we met like in our first holiday was in Lisbon that we went to Miami. We went to Barcelona, so, and he came to … he comes to Karachi every December. So that, and then San Francisco. So like just random places, right? That was one of the things I put in my head was like, Im not gonna go into this blind sighted, you know.  "
333,M,	What does he do? 
334,Su,"	So he works for. He works for a company called Young Canada, and they are the parent company for restaurants like KFC, Pizza Hut, Taco Bell, etc, etc. And he looks after… like he's a franchisee and business coach. So he's kind of like an operations as well as, like growing the franchisees business. So he travels. In fact, right now also he’s in Vancouver. So he travels a lot for work."
335,M,	All right. And had you been to Canada before you got married? 
336,Su,	No. 
337,M,"	Okay. All right now, I mean, we have actually discussed your professional background as well and in terms of your migration to Canada, did you plan this… So I suppose the right question would be your migration to your move to London. Was that by yourself? Or was that with your family? "
338,Su,"	No, I was by myself. That was myself. "
339,M,"	And how did you sort of come up with that? Like, why did you choose London over Russia or Pakistan? "
340,Su,"	To be honest, I didn't want I don't think Pakistan was even an option because I don't think they sort of sort of did the kind of law that I wanted to do. I think I was just kind of following the footsteps of my brother by going to school in London. But in hindsight, I probably had a better option going North America, or Canada do my law, but I believe it was I just wanted to get it done. I was not a very studious student in any case, so I was sort of like, okay, so we get it done three years done. With America, like or whatever you'd have to do like pre law then. You know, but like being in America would have definitely been a more wholesome experience. Yeah, but but London is fabulous. Great place. You know, at the time, it's funny because right now, couple weeks ago, I read that they changed the law… and the students who graduate from… foreigners who graduate from English universities have a 2 year to find work and whatever. At that time we didn't have that. And with Law, it was a very, like Oxford, Cambridge, very strict, aristocratic, sort of, selection process where the top law firms had people were graduates from there. And obviously people who are not of my racial ethnicity, if you could say that, so that was very competitive. And that's why I came home. "
341,M,"	And So I mean, in terms of work now, like you're looking for work now, what kind of work are you looking for? Is it legal or anything really?"
342,Su,"	I think, I would say say like, anything, really. But I kind of gave that thought up a couple of weeks ago. I don't want to do anything really, because it really does take away from who I am. I'd either go back into the Arts somewhere or the other, do something with writing, if that was… if I were to follow my passion. And if I were to stick to what my expertise are in, it's more like not for profit, fundraising, humanitarian sector, like international NGOs, and, UN, whatever. "
343,M,	And how are you finding the job market for those kinds of jobs? 
344,Su,"	Umm not too bad, actually. Okay, not too bad, because they, they're very, they're a lot more good with handing out these jobs to people who have like, would have had like a diverse sort of background and cultural, whatever, you know, ethnicity, as opposed to giving them to people who are from here. I don't know why that is but that's probably a good a good thing I guess? I don't know, or maybe people over here just more into like finance and marketing. And that's what I tend to sort of hear every time. So when someone says I have a job, they're like, Oh, well I work for a bank for we work for, you know, whatever a company like Lowe's or you know, retail and that kind of stuff. So maybe that job market isnt built or maybe it'll be funny that way. But it hasn't been like hugely competitive to get a couple of interviews here and there. Like, yes, with the bigger places for sure. But the smaller ones, you get something or the other. "
345,M,"	And in terms of visa status, like what sort of visa are you on currently and what kind of visa is your husband?.."
346,Su,"	My husband's citizen so I am …I applied for temporary resident visa, which is basically a visit visa and because I had that I could get into the country and that be inbound, and apply for a spousal visa. So technically, my status is that I am a non-resident but I am allowed to work in Canada because I have a work permit. But my PR is probably due six, seven months from now. The good thing is I have a work permit so that you know allows me to work before my PR."
347,M,"	And in terms of your move now… so your move to be with your husband? Yeah, on a spouse visa How long did you plan have to plan and organize? "
348,Su,"	Like a year before we got married or maybe at least nine months or 10 months before we got married. Like a lot of research out of like, what lawyers are we gonna get are going to apply ourselves? What are the forms gonna look like? And like I said, like we were always like antsy about the fact that you know, how am I…are we going to be married? How am I going to live like apart from you like 10,000 miles apart? That’s so weird. And then working that around, and talking with people talking to different lawyers, and then coming up and saying, well, no matter what you can be an inbound applicant. So that was a very stressful procedure, especially for my parents as well, because they just didn't think they just couldn't imagine like, and then it was also stressful for me because I was like, So where am I gonna live? Am I gonna live in your house, your parents? Or am I going to live with my own family? Coz it makes no sense to live in your house and blah, blah, blah, like that, obviously, raised a lot of conflict, and because of conflict and pressure was there I think we moved on. I think I really pushed it like…No, we have to find a way to do like the whole inbound or whatever alternative we have. And I'm glad that lawyers are lawyers were not good enough to sort of suggest that to us, because doing on your own is just not as…as efficient like I'd say yeah, yeah. "
349,M,"	And how's how's married life, generally living and moving into a new place? "
350,Su,"	What I'd say married life is Probably like..So I came in and obviously there's like a lot of expectations you have when you move in with someone that you're dating. And but it gets a lot of a lot different couple of months, well people say a couple of years down the line. In our case couple of months down the line. There were a lot of his travels, a lot of like challenges in terms of us getting along as people because we realized we're complete opposite in work like, you know, for fun, but then when it came to practicality, it was like, okay, clash, clash. So obviously one or the other person, or both the take step back in their personalities. But it's been, like it's been challenging.. ill tell you what, its been challenging and we don't share the same interests at all. Obviously, he's been in Canada for what 15 years. For me, I'm new so like every time, you know. So like every time I'm like I get excited about like, you know, going to Kensington Market or sitting on the patios like having lunch, and drinks and whatever during the summer or whatever. He's just like, yeah I've been there done that. And that's sort of like, you know, you’re kind of boring, like, but sometimes he'll he'll understand that like, okay, she just moved. But it really helps the fact that I've got like, some way or the other, a lot of my childhood friends ended up living here. So I do have like, a good like a good number of friends and close ones. I'd be like meeting someone or the other something, you know, you know, I'm not like.. And as far as him moving away, like my mother in law comes and visits in the summer. So she's here these days, and she's like, if you want to come and stay with… She lives with their daughter, her daughter’s not married, so she's like, if you want to come and stay or whatever. I'm like, you know, to be honest, like, I'm okay. Like, on my own. I actually like it, like, you know, and I don't get lonely or whatever, like that kind of thing. I mean, yeah, you know, I'm just I'm one of those like, I just do my own thing. "
351,M,	Your sister in law is in Toronto as well?
352,Su,"	Yeah, she works in Toronto. Yes. She’s been there. She's a year and a half older than my husband. She's not married. She's working for for Colgate Palolive. "
353,M,	So you do have family and friends Yeah. Which is which was gonna be my next questions. We'll discuss that when we do the mapping as well as. How long did your initial visa process take? 
354,Su,"	I'm actually good. Oh, yeah. So for the visitor visa, the first time I applied for it I got rejected because to be honest, it was a very rushed and most people do apparently from Pakistan. This is the hardest visa, the Canadian visa is the hardest to get. So and to be honest, to be fair, I didn't really put in a lot of documents. I didn't really apply from my heart. So I just sort of gave it in and I got rejected. This time around, like there was a lot of documents and stuff and like a lot of because this meant a lot more or more stakes involved. At that point. I was just going to meet my boyfriend. And then I was this time I was like, you know, I need a visa visa in order for me to get into the country after we get married, right. So the process itself didn't take very long I believed like I got an email maybe like 15 days down the line saying come pick up your passport, but the whole collection of documents and justifying things took a bit longer than that. Yeah, any other visa would say you would see how long isn't like a few months? maybe, you know, I'd say like was, I'd say a month and a half. Yeah, okay. Yeah. Yeah. Yeah, A lot of people like, like my husband's cousin, he applied, he has a Pakistani passport as well. So he applied from Dubai, like within five days he got it. From Pakistan, I don't know why they're just a little more stricter."
355,M,"	Okay, so, um, and final question before we begin mapping, how do you consider yourself? I mean, what are the skills that you bring with you to this country? How do you consider yourself to be a skilled migrant?"
356,Su,"	Um, to be honest, like, well, if I were to go for the typical like words like project management, not for profit management, you know, in terms of marketing, content writing, I’ve done a lot of that, communications, interactions and digital marketing and all of that. But if I were to really look at like, my passions and my skills into my passions, it'd be that you know, I could contribute a lot of cross cultural. Like I said, like I'd love curating like Pakistani exhibition artists exhibitions here. I'd love curating, like pop ups or stuff with like, you know, crafts and things made by underprivileged like woman in Pakistan. So I think the whole cross cultural thing really like link to art and crafts really does help me out. And then, you know, I don't know if that's a skill set, but I think I have a very creative mindset. It's like you give me something as long as you give it to me from the start of it, I will make something of it. And I think that's, that's one of the things that…I don't know if I have that cliche skill set. I've always kind of said, Well, I don't fall into that category anyway. And that's probably why a lot of people are like, Well, what does she bring to the table? Right? But, but there's something I can't explain what I do bring to the table, but it's just.. "
357,M,"	I think you explained it perfectly. Yeah. Yes, you will. Again, it's I don't think that all skill systems are about about actual physical like tangible. Yeah, they're about life skills as well. So I think that that's very important. Did your husband migrate here on the skills visa category? "
358,Su,"	Oh, he he moved here as a student, he went to UofT. So he moved here as a student..he was. He finished high school in karachi and he moved here when he was done. 2005-2006 – something like that. Like he is his family had also come a couple of years before that to settle in the kids and whatever. And then it was like they had applied as a family and by the end of I think, I think 2011-2012 they all got their passports or whatever. So the parents moved back coz there they have… my my father in law has a business back home and then and then. Well, yeah, yeah, they decided to stay. My husband's younger brother stayed for a bit, didn’t really like itwe, nt back to Karachi to join the family business, and then my sister in law is still here."
359,M,"	And in terms of cultural sort of change, I mean, I suppose we did briefly talk talk about how you grew up in a culture that was quite similar to Western culture. "
360,Su,"	Yeah. At least from me, not from my parents. My parents don't think that.. theyre like you’re Pakistani at the end of the day, I'm like, well, no Im not, like, yeah, I mean, I am but that not like a… that's not like a that's a nationality. That's not a way of thinking, you know, right. Yeah. That's, that's interesting. "
361,M,"	Yeah. So yeah, I mean, that's an that's a discussion that I have with my parents all the time. Yeah. But um, what about your husband like, is he very culturally Pakistani, or is his family very culturally Pakistani?"
362,Su,"	His family, I would say are very traditional but Modern Family. So he is not he's traditional in the sense like, now, that I'm living with him I get to know how traditional he is. But he's not like every time like say for example if you go out for dinner with a couple of people and they're not they're from Canada or whatever and someone asks how’s Pakistan and I'd be like Pakistan’s great like there's so much…you go up north, there mountains… you go south theres the sea. And he… hes just like Pakistan’s shit, like, wow that's one thing we clash on. Im like Amir, look like we have so many like there's so much culture like you know whether it comes to food or comes to traditions or folklore or whatever. He's not very proud Paksitani.  In the sense of gender roles and stuff, he's very typical but when it comes down to,"
363,"say like, he's not worried about what I wear, what I do. He's not like in traditional the sense that like, he has set of values and like systems that are… that go beyond superficial things like clothing and all of that it's all about you know, well did you… you know, take care of somebody? Are you hospitable? These are the things that I think comes from our culture because we as people are very hospitable. And we take care of our guests and he's always told me like I'm a hospitable as well, but he's always told me like, you know, guests whoever comes to our house…like that way you can tell the traditionalism coming in but and also the fact that when we started dating, he wasn't like he told me from the first day I'm not fooling around with you like if this works out. I want to get married to you. And I was like, okay, because guys, even in Pakistan dont say that. So that in that sense yes, I'd say he’s well valued but but but not like, you know, very pro Pakistan. Or maybe he just doesn't know it. ",
364,M,"	Okay, so we'll, we'll get drawing. So, the first question is, tell me about all of the visa categories you went through from the point of your initial arrival to current status. Now, in terms of your journey, I would also be interested in your…Was it a student visa to do the UK? So probably that as well. Went to the UK, you went back to Pakistan. Maybe you want to demonstrate that you were growing up in other parts of the world. It's totally up to you, but like basically all kinds of visa categories that you went through a journey or..journey around the world."
