582,D,"	I did not work but I received governmental subsidiary, like that was student support. So that was selective. If you are a good student you will receive that in 4 months. I also did IELTS [to study in France] – academic exam. Some of my friends they were using companies connected to universities but that was for UK. But the education in UK is huge money. We did both – IELTS academic and general fro both of this [France and Canada], lawyers – like lawyer company. They have so offices in Ukraine, in Toronto and some other places. I think HO is in Toronto and then there is branches. Its Canadian licensed lawyer. Most of the dealing was done online and then after the big chat that I want to apply, there was conference or seminar in my city so they said that if you want to meet her and see her, you can. So we just went and met and I would say that it wasn’t that personal meeting. You can ask questions in 5 minutes and understand how they work, and also trust. So went to the seminar before using. Other things were medical, transcripts, WES, translation. So my husband took English courses because, I was main applicant but he still had to do the test for some points. "
583,M,"	You were the primary applicants of what you went through the points test, right? Like the points. So what was the points threshold? You? You?"
584,D,	I don’t remember. I just got the answer yes! So I didn’t care much about the points. 
585,M,	So how did you for example choose this lawyer? 
586,D,"	Of course, okay you can figure out of lawyers but my mom had the bad experience so I was careful. Honestly I found this lawyer through my mail specialist. The person who brought my mail. You know they have a huge network; they know so many people. She said that couple of her clients, they left with the help of a lawyer. But she was still afraid to recommend me. Until the last day she was worried that if something goes wrong she will be responsible. So, she had a bit of stress too. But it was fine. It was more, I suppose safe, that she was a part of my network, like you know the people, at least through someone. That was pretty fine. That story – like it happened to my mom in late 90s. Now I heard some cases but I don’t know if they are certified people because I know now they should be certified. At that time, the whole immigration process was complicated. To get through that you need time, you need hours of research. But still you get what I mean. That’s why I prefer to use a lawyer. Even the date, the date you apply plays a role. The same application a couple of weeks later could be different. So now, I know they should be certified and you can check them online. At that time, I don’t know, maybe I was lazy.. It was comparing to the salaries I get in my country, it was expensive. Considering I managed to save money working on the international project, I was fine. If I didn’t do the Asian games project, I wouldn’t be able to do this. "
587,M,	So with the Asian Games you went away like you were not in Azerbaijan at the time?
588,D,	Yeah I went for 2 months in Indonesia. 
589,M,"	All right. So now in terms of other other things that you spent money for, was it an expensive process overall? Sure. Was this an expensive process overall because you spent money with you have two aisles, right? And three for your husband. So"
590,D,"	Honestly, I did IELTS three times. It was so ridiculous because once I had a mark of 8, at least 7.5 or 8. So average was 7.5 but the minimum mark for each section should be 7 and I don’t know why, couple of times….once I had 7 and overall was 7.5, once I had 6.5 and 9…so still in average it was fine but not 7 in each. So I had to go 3 times.  Also, I did translation services of Diploma, and the Minister of Foreign affairs confirmation for Diploma, like conformation by local authority. Also, here, that was for my husband mostly. "
591,M,"	Alright, let's move on. So now let's talk about the role of technology in your migration. And I'm talking about overall technology. So how did you use let's say online research, social media, communicating with lawyer, anything, anything that you needed technology for?"
592,D,"	I needed the technology for everything because I was sending for here except for WES and some transcripts because that was by mail. So here it was email – all coordination and registration and results [IELTS] – all communication was like skype, emails. Also, I will not mark the rest because that was in person, translation was in person, WES was by mail. The transcripts I had requested by main from my French university, so they had to send to it WES directly. I cant say I studied a lot but what I studied was enough for me to understand that I need to hire a lawyer. I'm really lazy person. I'm not so stupid but I'm too lazy [laughs]. I used the internet mostly to get general information on immigration. I don’t know exactly but the governmental immigration website, CIC… and upon arrival same website for finding my realtor… that was the first website, I have it in my email [checks email]. And I was using WhatsApp mostly before arrival. That was only discussions. Now I join FB groups but then it was mainly that. I still use Whatsapp mostly for family and friends lets say. Here I used more skyping, and emailing still was common practice. I used FB but just scrolling – not much. Maybe just social groups. You start talking to people and then you get busy and don’t reply and then it comes up that you didn’t respond for a week and im that person, I feel ashamed to write afterwards again so sometimes it just goes vanished. I hate the discussion forums. Im not in that. "
593,M,"	So we'll move on now, let's talk about your social connections so friends, family, 		Anything that is a big role of the family or friends or professional networks."
594,D,"	I don’t have a big family. Significant I would say the support from my mom – in both cases. Both emotional and financial, I would say, until…lets start from here [France0 Financial support for sponsorship, I’m the only child and…. here and here [Toronto] mostly emotional, sometimes financial by mom, Toronto is an expensive city. So that was the JVS company that directed me to the bridging program. So that was the JVS employment services for placement and support with application to governmental program, support for employment for future employment and still they have covered some expenses like free books for the course, business cards. So here the student support was financial. That’s it for now. "
595,M,"	Okay. All right, no worries we'll we can go forward and if that's your if you're done Did your migration affect your family? So your mom is she still there?"
596,D,"	Shes alone at the moment. That's the thing she needs to not accept, to over come at some point because after sometime when I get an opportunity to work and become more stable, I will bring her here because otherwise we both would stay there and having no big perspectives so its better to hope for that now. I don’t know if I could explain that. In the future, but not like in a year or 2. Shes working now. Shes fine now. Shes not an old lady with a cat or somethings – its not a depressing situation [laughs]. I lived with my grandma and mther before marriage. When I got married 5 years ago, we lived separately. Just me and my husband. "
597,D,"	For example, like traveling, documents and stuff, I had to provide this information. I made this like a separate file, tickets and all. Generally, I wanted them to do that [filling immigration forms] because they have a passport, so they know. They know better. Instead of me asking in five minutes, questions."
598,M,"	Okay, great. Are you into Are you currently looking at immigration policy is now like once you've arrived? Did you ever look at immigration policies or were involved in the political sort of part of immigration?"
599,M,"	I wouldn’t say I do check I a lot but you want to know whats going on. But I don’t get deeper into that atm. Im more interested in government, like certain, certain like educational and medical field feel that that affects me more at the moment. I don’t know maybe some major  changes would interest me but small stuyff, not. Im interested to watch it atm [elections]. Im not interested to participate because I don’t have the full rights to participate at the moment. You can vote when you get citizenship. That’s the only difference between PR and citizenship. "
600,M,	 Tell me about the biggest challenges of migration…challenges or obstacles.
601,D,"	All these challenges or obstacles you face, once you arrive, sooner or later you will solve them. So this one, not big one, missing.. like my husband he has a diploma that he didn’t actually receive because people in the university, they were lazy and they didn’t do it – So diploma is like a book so they just sent it without transcripts and all. Missing pages in the diploma. We knew the people who were working in the university so they solved our problem fast. If we wouldn’t know that, because that was the time of summer, if we wouldn’t know these people, it would extend it for 3 or 4 months and still we need to go and ask them. You know sometimes they send it somewhere else. We managed to solve this in 2 or 3 weeks. Its not so much considering that they had to dig, take it out of the archives and do the job, and to stamp it, and to sign it. I was surprised it was solved that fast. The challenge – the biggest challenge and still for now is like, employment and in my case, first thing that is challenging is that there is no Canadian experience which they stick to no matter where you work. It can be McDonalds, or any other place, cleaner, doesn’t matter. If you don’t have Canadian work experience, it reduces your chances of employment. So, lack of Canadian experience and they want it usually longer than a year. I have here like 5-6 months. They usually write like 3 years on Canadian experience, 5 years of Canadian experience in the job ads. I find it a challenge because that’s n ot fair. The thing is that if I was told that they don’t care the skills in Canada you have so even the cleaner, or some service jobs – they still would consider it a Canadian experience. Even if you apply for design but you haven’t worked in design, they still would consider you. But I think that’s the perception coz I was working in an international environment and I know the system – how it works. So maybe for some people its important. You also have interviews for that to understand that people can work or not. But on the point of applications, you should not just throw the paper without looking at it. Certifications, licensing, there is also another local expect for WES, another diploma confirmation. So, WES works only for arrival. Here, you need to go to another, in my case. WES only works for immigration purposes. Generally, its good. I had it added in my resume but actually, the diploma is confirmed by WES. This certification, this should be a CACB authority – that’s architecture board. Im not sure if planning has it as all. But they are some courses that are not approved at all. But I hope to do that in some time because it is still costly. The challenge I would say, is finding an apartment because you don’t have a credit history and that reduces your chances. We behaved well and very nice, really because I have education and I can say that im not going to not pay you money. I don’t want that problems. I think that’s – maybe that’s a perception but that still works in some cases. I found the driving licence a major obstacle for me. Yeah, coz I didn’t have a car before. I had a license back in my country before. Here the system is.. first of all you get the G1 which is training. Then after a year you still can drive only with a person who has the G4. I can only drive on my license only for 30 days or 60 days. And I failed it too. And the thing is I need a confirmation from my country to get the licence directly but that’s an issue now that I am here. And still this is an obstacle for jobs as well because even if I have a good commute to the location of the interview, most of the cases they ask about the driving license. That’s an issue because in most of the job descriptions, it is written that they require a G4 driving license. So for me, its like a huge… its not a challenge, its an annoying. I decided to wait for the confirmation from my country because I don’t want to go through the test again, because what if I don’t pass it again. When I have this letter, they allow me to get the license directly. I just applied it today. That was local fee plus payment to home country embassy for driving experience confirmation. [husband] did that already. So he did that I didn’t and we decided to do that because at least one of us would have it. "
602,M,	Have you given migration advice to any other person about Canada?
603,D,"	Yes but I'm not sure if they move forward with that but couple of my friends, they are interested and, I think they are considering in the next couple of years not immediately. Im never active on advising unless they ask for that and that's their decision absolutely so if I can advice…im not going to push. In one case I just said like you know just do it if you want to do this..go to Canada if need to do some changes you should start instead of just sitting complaining. "
604,M,	Did you receive any bad migration advice from anybody?
605,D,"	I heard a lot of complaints from the people for here. Always the people who stay here say that go back. There's some sort of people are never satisfied. They're always complaining. So I just try to avoid this people. That was on the forums maybe just maybe once or twice on YouTube, by community. They complain in some cases. Like what happened was my husband was addicted to youtube before arrival to Canada. Like last two weeks. He was just sitting so stressed. I just asked…What are you? Why are you so stressed? It looks like so bad he told me. I said Why? And he said I watched it on YouTube. I was like can you imagine any normal person was satisfied with his life, coming to YouTube and saying how good it is? No. Usually people come to complain. You only hear mostly the negative. Especially for post-soviet people..the mentality of our people. It's not only them…. I am like this too, but not so much. I hope so. Always complain to find the bad things, to discuss it…this could be better or I had it better before. Usually you watch it in your own language and this people, when you Google it, it comes out as research. You see the negative just stop watching that please please…And he said like yeah, maybe you're right. And really the fact that maybe we didn't meet the circumstances this people met when they came. Its like I've got a I had a little allergy, and its cancer. Yeah youre gonna die according to Google. "
606,M,	 Let's talk about future plans.
607,D,"	I would say first one in the nearest one is getting the mortgage. Probably that’s after we have a proper income. Own home or apartment. Then I would…like citizenship. We would like to have kids, I don’t know where it comes. In between somewhere [laughs]. I would be happy if I have 2 kids. Probably get the mortgage before they come so they have a house. In the more future. I don't know how is it possible, Maybe a design company? That one is very far but I would like to invest in green technology, not developed but, there are many young researchers to do their job very well and they just need to push to get into the market. You know that franchise thing? You get their idea and stuff and they still get to participate… something like that…maybe in, how can I say it? green technologies – but that’s way too far. Production maybe? "
608,M,	Will you consider migration anywhere else?
609,D,"	Maybe in retirement. At my home country I was moving. 4 times, I was changing my"
610,Place…. the apartment. I was moving four times in the last two years. Then I was traveling to work to another place. I went through three renovations in the last two years and then immigration here. So im really tired. Im done. I need my place for at least 10-20 years. Im tired. ,
611,M,"	And I think I'm done pretty much. But if there is anything else that you think that you want to add on the map that I haven't asked you, anything else that you want to comment on or see, you can do that. You can do that now."
612,D, 	I think I told you my whole life. 
613,M,	 How do you feel about it? What do you think about this whole journey? 
614,D,"	I think I did a good job. The whole journey, I can say everything was on time. Like if i got to immigrate at the age of, after University, everything has its own benefits. At the time I had to come back because I didn’t plan much. But afterwards, when I came back, I got married. I had the job I had the job very interesting job I wouldn’t get in France at that level. Oh, so that’s something here - for Junior position they consider me as overqualified. In intermediate positions, I don't get to that stage. So, in many cases, they…when I applied for the project technician lets say, they say you need to go more to design. When I go to design, they say I don’t pass the search engines. So, I become may be overqualified or under qualified. Overqualified for junior and under qualified for senior. "
615,M,	How do you like Toronto? Do you like living here?
616,D,"	Umm yes, One thing about the choice of the city is that… most cities in the"
617,"world will have the sea. The beaches, and you get a lot of fresh air. So one of the other reasons I choose Toronto is because it has a huge lake. I don’t live by the lake but I do have the opportunity to go and see when I want. Its pretty costly to do things at the moment because of the financial situation. But we are in the process of getting a car. Its still the cost of insurance, its like crazy. The average is around 200 a month which is a lot. For me at the moment, I don’t need a car. Its also crazy parking prices. I would rather drop it at a subway that has a parking and take the train. But for my husband, hes commuting to the north part and there are only buses and the distance is not that much but he wastes like one hour for only 5 kms. So he definitely needs a car.M",	Let's begin with when you first arrived to Canada
618,Ol,	I arrived on April 29 2013?
619,M,	That is very specific. Wow. And what was up as a student visa? 
620,Ol,	It was student visa when I came. 
621,M,"	And what were the motivations behind your migration? Like, what were the main factors you considered in making that decision?"
622,Ol,"	I think if I had to pick one, I would say the political climate in Mexico. It was the party that used to govern Mexico, and basically turn Mexico into pieces, was going back into power. And everything was getting really dangerous, crime was spiking again. And I was just tired. And also those lack of opportunities, so what happens in Mexico is because of the economy model that is used… the gap between middle class and high class is getting really really big right to the point that right now there's not really a middle class in Mexico. It's either you have a shit ton of money or you're working class and if you lose your job, you're basically homeless. So I was approaching the bottom and and that was just tired. I was just tired of being working 10 to 12 hours a day plus something extra to come later just to make extra money. And then I think the cherry cherry on the cake was the this the Peña Nieto who was a president, he won. It was a fraud but he won and he was going to be the party is going to come back and steal everything… just destroy the country again, which it happens. But I wasn't there anymore. But that was the main reason why we decided to move. Me and my wife. "
623,M,	And which part of Mexico were you in?
624,Ol,	Mexico City 
625,M,"	Okay. And that was the only motivation, sort of the main one, like what other factors that you consider?"
626,Ol,"	That was the main one. I would say there are other factors that, that I know when I think back at the time, I know like one was, I think I wanted to reinvent myself. That's one thing that I couldn't be. I couldn't do it in Mexico. Another thing I would say I wanted to experience a different culture. I worked for a few months in Spain. Yeah. And I really liked it. But I also wanted to go to North America, and I don't like United States or Canada was my first option."
627,M,"	Okay, and why Canada? I mean, we I've you just said that Canada was your first option, like had you done a lot of prior research into Canada? "
628,Ol,"	I did research Bunch of countries based mostly Europe, Canada, US… even and I consider the US. So it's a North America, Europe and Australia at some point, Australia too. Yeah, I checked that. And after so I'm so just to give you something Yeah, I'm a project manager. I'm an engineer, I have a software engineering degree. So, I'm very methodical person. So basically, created a huge spreadsheet with pros and cons for every country.. So, it was kinda interesting that I mean, the first thing that we consider was we need speak the language. That's one of the things that we wanted…that narrows or I mean, not a lot, but now is basically to the US, Canada, in America, the UK, I mean, Scotland and Ireland and Spain as well and Australia. was basically that in the end that those ended up being a..lets say second choice. And then after that I did all this analysis and all the immigration processes of the openness of the culture regarding immigration. And after reading all that, I realized that Okay, so it's Australia or Canada. Those are the more open cultures loving immigration. So either or so, and the main decision was well Australia’s kinda far. And so if, and it had happened, so if one of our family members of friends die, we want to be there. If we took a flight from Australia to Mexico City..it's like 27 hours. If you took a flight from Toronto to Mexico it is four hours. So that was the deal breaker. "
629,M,"	So in terms of ethnic background, you and your wife both always been in Mexico?"
630,Ol,"	We were born and raised in Mexico. And or families… I don’t know if it matters to you, but my family and my mom's side is from Japan. I'm fourth generation Mexican. So, my great grandfather came in then my grandfather was born in Mexico, my mom and me. So, and on my dad's side, they're from Spain, but they came two centuries ago. So that's kind of lost and my wife, so one side of her family's from Spain, and the other one is from Lebanon. But she's third, second generation in Mexico from Lebanon. So, her grandfather migrated from Lebanon to Mexico. "
631,M,"	And, um, let's talk about professional background now. So, you said you work as a software engineer or project manager?"
632,Ol,"	Computer Engineering is my degree, okay. I used to be a developer for a few years after high school then I moved into product management. And I did that for 10 years and now well mostly… We still pretty much it’s the same but it's a different role. It's just, like more like a client facing role, but still project management-ish."
633,M,"	Okay, so you are doing what you were doing back home. Like it's the same kind of industry, it's the same industry similar roles?"
634,Ol,"	Okay, cool. "
635,M,"	Um, and in terms of planning your migration like pretty much the first move How long did you spend in terms of researching and planning like in terms of time, total in total?"
636,Ol,"	So, we decided to move after we got married. We got married in 2008. I think it was like end of 2009 when we decided to move here in 2013, so I’d say like, around three, four years. Doing research planning and applying learning French, all those kinds of things. So very basic mine, my wife is better, but we did learn some things. We hired a teacher for French in Mexico."
637,M,	And that gives you more points?
638,Ol,"	Give me… I think you gave me like, three, three points for me and six to my wife."
639,M,"	And did you like did you think about particular sites of where you wanted to move? Like, were you sure that you wanted to come to Toronto for example? Okay, yeah, so not other parts of Canada."
640,Ol,"	We consider Montreal and Vancouver at some point, but our main choice was always Toronto mostly because this at the time, where we knew it was like the financial centre of Canada first. So, All the money's here. So, you want a job, mostly the jobs are paid well here. And the second one is somewhere where there was a plan to expand Ontario's technology budget to make it easier for IT companies to come in, starting in 2015, or something was 2016. So, I read that. And I remember it caught my eyes like, well, it's better to be there to have to know some people were ready when when this comes. It's going to be huge. And it's coming right now. You can see now, some bunch of technology companies opening up many branches here. "
641,M,"	And in terms of your options that were available to you, so did you know that you had to go on a student visa or were there other migration options available to you You can, what kind of options Did you consider"
